{
  "$schema": "./package-manifest.schema.json",
  "schemaVersion": 1,
  "name": "ai-baseline-kit",
  "version": "0.12.1",
  "type": "embedded-ai-capability-package",
  "description": "AI 前端模块装配系统：可完整植入目标项目，支持需求确认、结构化生成、验收测试、同栈模块迁移组合、AST 边界检查和旧项目增量治理闭环。",
  "entrypoints": {
    "primary": "AGENTS.md",
    "documentation": "README.md",
    "installation": "INSTALL.md",
    "skills": "skills/README.md",
    "validation": "scripts/baseline-check.mjs",
    "stackProfiles": "docs/stack-profiles.yml",
    "doctor": "scripts/project-doctor.mjs",
    "bootstrap": "scripts/project-bootstrap.mjs",
    "projectValidation": "scripts/project-validate.mjs",
    "toolSelfCheck": "scripts/project-tools-check.mjs",
    "reactTemplate": "templates/react18-antd-tailwind-ts/README.md",
    "vueTemplate": "templates/vue3-vite-ts/README.md",
    "contractSelfCheck": "scripts/baseline-contract-check.mjs",
    "requirementCompiler": "scripts/requirement-compile.mjs",
    "featurePlanner": "scripts/feature-plan.mjs",
    "featureGenerator": "scripts/feature-generate.mjs",
    "moduleCreator": "scripts/module-create.mjs",
    "featureSpecSchema": "docs/feature-spec.schema.json",
    "changePlanSchema": "docs/change-plan.schema.json",
    "moduleMetadataSchema": "docs/module-meta.schema.json",
    "designSystem": "docs/design-system.yml",
    "templateBuildCheck": "scripts/template-build-check.mjs",
    "moduleExporter": "scripts/module-export.mjs",
    "moduleImporter": "scripts/module-import.mjs",
    "moduleCompatibilityChecker": "scripts/module-compatibility-check.mjs",
    "projectComposer": "scripts/project-compose.mjs",
    "moduleBundleSchema": "docs/module-bundle.schema.json",
    "projectCompositionSchema": "docs/project-composition.schema.json",
    "astBoundaryChecker": "scripts/ast-boundary-check.mjs",
    "moduleDiscovery": "scripts/module-discover.mjs",
    "moduleBundleRepair": "scripts/module-bundle-repair.mjs",
    "compositionOrchestrator": "scripts/project-compose-from-requirement.mjs",
    "compositionContractSelfCheck": "scripts/composition-contract-check.mjs",
    "compositionRequestSchema": "docs/composition-request.schema.json",
    "compositionRunSchema": "docs/composition-run.schema.json",
    "moduleDiscoverySchema": "docs/module-discovery.schema.json",
    "smartComposer": "scripts/smart-compose.mjs",
    "workspaceDiscovery": "scripts/workspace-discover.mjs",
    "controlledChangeExecutor": "scripts/controlled-change-executor.mjs",
    "intelligentAssemblerSkill": "skills/intelligent-frontend-assembler/SKILL.md",
    "executionPolicySchema": "docs/execution-policy.schema.json",
    "controlledExecutionSchema": "docs/controlled-execution.schema.json",
    "workspaceDiscoverySchema": "docs/workspace-discovery.schema.json",
    "workspaceIntentSchema": "docs/workspace-intent.schema.json",
    "controlledExecutionContractSelfCheck": "scripts/controlled-execution-contract-check.mjs",
    "smartComposeContractSelfCheck": "scripts/smart-compose-contract-check.mjs",
    "smartDeveloper": "scripts/smart-develop.mjs",
    "documentNormalizer": "scripts/document-normalize.mjs",
    "acceptanceCoverageChecker": "scripts/acceptance-coverage-check.mjs",
    "intelligentDevelopmentContractSelfCheck": "scripts/intelligent-development-contract-check.mjs",
    "normalizedDocumentSchema": "docs/normalized-document.schema.json",
    "smartDevelopRunSchema": "docs/smart-develop-run.schema.json",
    "acceptanceCoverageSchema": "docs/acceptance-coverage.schema.json",
    "unifiedRunner": "scripts/ai-run.mjs",
    "ciGate": "scripts/ci-gate.mjs",
    "projectUpgrade": "scripts/project-upgrade.mjs",
    "projectStateLibrary": "scripts/project-state-lib.mjs",
    "projectStateSchema": "docs/project-state.schema.json",
    "packageUpgradeContractSelfCheck": "scripts/package-upgrade-contract-check.mjs",
    "systemSpecification": "docs/system-specification.md",
    "skillStandaloneGuide": "docs/skill-standalone-guide.md",
    "systemOverviewDiagram": "docs/assets/ai-frontend-module-assembler-overview.svg",
    "systemOverviewDiagramPng": "docs/assets/ai-frontend-module-assembler-overview.png",
    "usageGuide": "docs/使用指南.md",
    "deliveryGate": "scripts/delivery-gate.mjs",
    "implementationCompletenessCheck": "scripts/implementation-completeness-check.mjs",
    "deliveryReceiptLibrary": "scripts/delivery-receipt-lib.mjs",
    "deliveryReceiptSchema": "docs/delivery-receipt.schema.json",
    "deliveryClosureContractSelfCheck": "scripts/delivery-closure-contract-check.mjs",
    "buildArtifactGuard": "scripts/build-artifact-guard.mjs",
    "buildIsolationContractSelfCheck": "scripts/build-isolation-contract-check.mjs",
    "upgradeManifest": "upgrade-manifest.json"
  },
  "installation": {
    "guide": "INSTALL.md",
    "modes": [
      "embedded-directory"
    ],
    "copyItems": [
      "ai-baseline-kit/"
    ]
  },
  "distribution": {
    "mode": "embedded-directory",
    "preserveDirectoryName": true,
    "targetDirectory": "<project-root>/ai-baseline-kit/",
    "companionFiles": [],
    "sameStackRequired": false,
    "buildIsolation": {
      "gitTracked": true,
      "npmPack": "nested-npmignore",
      "deploymentIgnoreFiles": [
        ".dockerignore",
        ".vercelignore"
      ],
      "artifactGuard": "postbuild-clean-and-verify"
    }
  },
  "dependencies": {
    "packages": [],
    "runtime": [
      "Node.js >=20"
    ],
    "external": []
  }
}
